{
  "v": 1,
  "run_id": "s5-cell-uuid",
  "seq": 3,
  "t_req_start": 152340,
  "t_req_body_end": 152355,
  "t_upstream_sent": 152358,
  "t_first_byte": 153010,
  "t_last_byte": 161200,
  "duration_ms": 8860,
  "method": "POST",
  "path": "/v1/messages",
  "protocol": "anthropic_messages",
  "model_requested": "anthropic/claude-x",
  "model_served": "anthropic/claude-x",
  "status": 200,
  "streamed": true,
  "usage": {
    "input": 48213,
    "cached_input": 31400,
    "output": 512,
    "reasoning_output": 0
  },
  "usage_source": "response_body",
  "error": null
}
